title,content,date,url
Is the US Decision to Withdraw from Syria in 2019 a Mistake like its Decision to Withdraw from Lebanon in 1983? – By Prof. Robert Rabil,"Professor of Political Science at Florida Atlantic University. 



email: rrabil@fau.edu Twitter @robertgrabil Robin Wright; an astute journalist and analyst; wrote an article in the New Yorker on “The 1983 Beirut Barracks Bombing and the Current U.S. Retreat from Syria.” She makes the case that the U.S. withdrawal from Lebanon following the horrific 1983 bombing of the U.S. Marine barracks resonates; hauntingly; as U.S. Special Forces pull out of Syria. She asserts that: “Once again; the United States is hastily retreating—abandoning a mission; stranding allies; creating a vacuum for adversaries to quickly fill; enabling Islamic extremists; weakening American credibility globally; and leaving the Middle East; the world’s most volatile corner; even more unstable.” 



This argument; grounded in a belief in American exceptionalism as well as its ability to fix or improve bleak situations; makes sense to many. Many Americans believe that that the U.S. should not retreat from the Middle East in the face of failed American military interventions in Iraq and Afghanistan. But this noble attitude does not fully examine the background against which the U.S. retreated from Beirut; Iraq; Damascus and Kabul. 



As someone who lived the Lebanese civil war as a
volunteer in the Red Cross and observed closely the preparation and execution
of the invasion and occupation of Iraq I consider that Washington’s retreats as
being born out of both its universal values and naivety that clashed with its
foreign policy missions. 



In 1982; Washington led the international community in
creating a Multinational force (along with French and Italian troops) to
supervise and safeguard the PLO’s withdrawal from Beirut following Israel’s
invasion and siege of the capital. The withdrawal began in late August and
ended in early September. On September 14; President-elect Bashir Gemayel;
along with a number of his lieutenants; was assassinated in his East Beirut
Phalange headquarters. I vividly remember the pall of gloom that descended on Lebanon;
especially among Christians; following his assassination. On September 16; the
IDF infiltrated a Phalange-led intelligence unit under Elie Hobeika into the
Palestinian refugee camps of Sabra and Shatila to “ferret out” PLO fighters who
remained in the camps. What followed was a horrific massacre of mostly old
people and children. Although previous massacres did not elicit the world’s
outcry; the magnitude of the Sabra and Shatila massacre was not only met with an
international outcry; but also damaged the reputations of the Phalange and the
IDF. 



The Israeli public; in contrast to the Arabs; held the largest demonstration in Israel’s history in Tel Aviv and called for the IDF to withdraw from Lebanon. It was only a matter of time before Israel was pressured to withdraw from Lebanon. The murder of Gemayel and Israel’s gradual withdrawal changed Lebanon’s civil war dynamics. The new president Amin Gemayel; brother of Bashir; did not command the full loyalty of the Christian Lebanese Forces; whose leadership had begun to fragment; Antagonistic forces rushed to fill the vacuum left by Israel’s withdrawal. Led by Walid Jumblat; the Druzes; supported by leftists and pan-Arab forces; defeated the Lebanese forces in the Shouf mountains; and the government of Amin Gemayel tried and failed to control West Beirut; which witnessed a mass mobilization of leftists; Shi’a Islamist groups and the Shi’a Amal party.



In the meantime; President Reagan; moved by the sorrowful
and distressing flurry of unfolding events; decided to change the mission of the
MNF. On October 28; he signed National Security Decision Directive (NSDD) 64;
“calling for the United States to work toward the withdrawal of foreign forces
from Lebanon; help rebuild the Lebanese Army; and contribute to an expanded MNF
if necessary.” But his well-intentioned and ambitious new mission was not
timely reinforced by a bigger and stronger American force just as internecine
fighting and regional meddling in Lebanon reached a new peak. 



Even
at an early age I shared my father’s concerns for the U.S. Marines. The
question that troubled me most was why the U.S. Marines located their
headquarters next to the airport in Beirut’s most volatile area. In hindsight;
other horrific events should have underscored the fleeting objectives of
Reagan’s new MNF mission. A new tool of terror; traced to Ayatollah Khomeini’s effort
to reinterpret Imam Hussein’s martyrdom in Karbala in 680; justified suicide
bombings based on fighting oppression and injustice. Before the bombing of the
U.S. Marine barracks in October 1983; the Israeli military headquarters in Tyre
and the American Embassy in Beirut were bombed respectively. Robert Baer; a
shrewd CIA operative; contemplated that the United States failed to notice the
warning signs of the 1983 bombing. 



President
Reagan had two choices: be fully involved militarily in a country in the midst
of a brutal civil war or get out. Reagan grasped the danger of the treacherous politics
of Lebanon and chose to get out. Since then; the U.S. should have grasped the
fact that any mission in the Middle East has to be buttressed by significant
American power not only to affect the context in which American troops are
involved but also to dictate the outcome of American involvement. In other
words; half-hearted measures in the Middle East do not work! 



So;
indeed; “the ghosts of Lebanon are in Syria today;” as Ryan Crocker observed.
But herein lies the main question: how deep is the U.S. commitment to to its
mission in Syria? The hard truth is the U.S. has neither a well-defined mission
nor one that it is able to implement within a reasonable time span. The U.S. set
itself up for tragedy. It also set the Kurds up for tragedy.         



In
this respect; President Trump’s decision to pull out of Syria—like Reagan’s
decision thirty-five years—is about saving American lives!                                
Share this:EmailFacebookTwitterReddit","Posted by Joshua on Saturday, October 26th, 2019",https://www.joshualandis.com/blog/is-the-us-decision-to-withdraw-from-syria-in-2019-a-mistake-like-its-decision-to-withdraw-from-lebanon-in-1983-by-prof-robert-rabil/
Syria: is it time for the West to talk with Assad?,"By – BOB BOWKER; who is a former Australian ambassador to Jordan; Egypt and Syria. He is now an Adjunct Professor at the ANU Centre for Arab and Islamic Studies.



19 Sep 2019  – Published first on the Interpreter at the Lowy Institute & reprinted on Syria Comment by permission of the authorEngaging Assad; while repugnant; is better than wordsof sound and fury delivered that makes little difference.



Bashar al-Assad; like his father before him; proved determined to not ask open-ended questions in Syria about the relationship between state and society (Photo: Kremlin.ru)



Syria is one among several Middle East regimes which believe that repression; if not used in moderation; provides a necessary answer to challenges to the existing political and social order. Accordingly; Western governments have to decide the relationship they wish to have with Syria; and its neighbours and friends; including Iran – and how they wish their values to be reflected in their approaches to that relationship.



Understanding the consequences of the Syrian tragedy for our interests should lead us to support carefully calibrated re-engagement with the Assad regime. The alternatives are worse.



Bashar al-Assad with Russia’s Vladimir Putin at Khmeimim air base in Syria in December 2017 (Photo: Kremlin.ru)Without respect for principles and institutions of international humanitarian law; and efforts to hold accountable those who breach them; predictable and constructive dealings between states and the harnessing of human potential are hardly possible. An absence of respect for those principles; both domestically and in dealings between states ­– and the weakening of political will to defend robustly the values of political liberalism and the moral authority of international norms and values – brings us closer to the scourge of war.



But in the case of Syria; behind that self-evident truth are complex political and moral issues.



If concerns exist at all in Damascus for the absence of accountability for brutality in the name of security; or for the opportunities for recruitment and indoctrination afforded by burgeoning prison environments; torture; and other abuses; they are seen as issues of a lower order than the immediate need to preserve the identity and essential character of the state itself.



Advocacy for human rights must be framed within a realistic acceptance that any return to effective political leadership will have to come about within the existing power structure.



Bashar al-Assad; like his father before him; proved determined to avoid the asking of open-ended questions about the appropriate relationship in Syria between state and society. Meanwhile; the ideological disposition of opposition groups was reduced from mid-2011 to an Islamist-inspired rejection of the existing social and political order.



Whether responsibility for the human tragedy of Syria rests mainly with the Syrian regime; other governments; or non-state actors; it is the Syrian poor; and the marginalised; who have been demonised; dehumanised; and exploited. And the values that best protect Australia’s interests at the global level have suffered as respect for international law has been set aside by the parties to the conflict.



The challenge is to find an acceptable balance between upholding core principles of international humanitarian law in the Syrian context; and recognition that without a return to economic growth and security; those principles; however worthy we may consider them to be; will matter little to those Syrians who are most vulnerable.



The application of economic sanctions to Syria – in practice; a manifestly inhumane; ineffective; and altogether despicable assault on the most vulnerable elements of Syrian society – add to the challenges ahead.



There is no chance of security or durable progress in Syria without economic advancement. The opportunity costs; in terms of wasted human potential; corruption; and human rights abuses associated with repression; insecurity; and conflict all weigh heavily against the likelihood of achieving levels of balanced economic performance that can restore infrastructure and human capital and combat Syria’s growing ecological threats and food and water insecurity.



But in Syria; and elsewhere in the region; advocacy for human rights must be framed within a realistic acceptance that any return to effective political leadership will have to come about within the existing power structure. A leadership that has proven willing to see the death and displacement of so many of its own citizens is not going to relinquish or genuinely share political power beyond its immediate base.



The incremental advancement in Syria of empowerment; within the rule of law; at all levels; from the state to the society to the household; is as desirable and yet as remote a prospect as ending abuses of human rights. And remaking Syria – or Yemen or Libya – for the benefit of their citizens may not be possible without remaking the wider Middle East.



History suggests that is something to which the rest of the world is unlikely to make a positive contribution. And words of sound and fury delivered in multilateral forums will make little difference in practice to Syrian behaviour.



But if we wish our values to be respected among future generations of Syrians; and elsewhere in the region and beyond; we should be prepared to stand up for those values by using such political; diplomatic; and intellectual leverage as may be available to us. And we should be prepared to take a long-term view of what is required.



Syria; not unreasonably; sees itself as deserving of international recognition as a country of substance and importance in the Arab and regional context. The ending of its isolation from the international community is important to it.



Calibrated; strategically planned re-engagement; in consultation with Western and Arab partners; offers the most likely path to seeing a Syria emerge which; like Tunisia; chooses to benchmark its achievements as an Arab state against contemporary ideas among a younger generation; in Syria and within the wider Arab world; of what it means to be Arab and “modern”. And it is among those ideas of what modernity looks like that the norms and institutions of international law are most likely to be respected.



The extent and timing of steps to help Syria move in that direction may depend; in practice; on a parallel process of realignment of dealings between Washington and Tehran. There must be some semblance of respect for the dignity and rights of its ordinary citizens if re-engagement with Western countries is to proceed. Russian sensitivities would need to be handled with particular care. But there is a strong case; humanitarian; diplomatic; and otherwise; for further exploration of the limits to the possible.



For their part; Western governments will see their interests served best; not by ongoing insecurity and conflict and the imposition of collective punishment in Syria; but by the re-emergence; over time; of a Syria that is once again confident; economically dynamic; socially progressive; and respected within the region.
Share this:EmailFacebookTwitterReddit","Posted by Joshua on Thursday, September 19th, 2019",https://www.joshualandis.com/blog/syria-is-it-time-for-the-west-to-talk-with-assad/
The role of MI6 in Egypt’s decision to go to war against Israel in May 1948 by Meir Zamir,"Egypt’s King FaruqFirst published in Intelligence and National Security; May 28; 201970 years on from the end of the Arab-Israeli War; new documents shed light on the political intrigue that surrounded the motives of the geopolitical powers in the region. Just as Israel wields influence with the Arab Gulf States in the ongoing crisis with Iran; the 1940s saw the European powers play a role in the pivotal conflict that drastically altered the Middle East for decades to come. In this article; Dr. Meir Zamir; Professor Emeritus of Middle East and Intelligence Studies at the Ben-Gurion University of the Negev; analyzes the case of Egypt’s decision to go to war against the nascent Jewish state and the influence of the British Empire that laid behind the Egyptian government. – CS



ABSTRACT



David Ben-Gurion; the founder of the State of Israel; repeatedly accused Britain of provoking the Arab states to invade Israel the day after its establishment in May 1948. To date; historians have not found proof of his accusations in British archives. However; evidence may be found in French archives; especially in Syrian and secret British documents obtained by the French secret services; originating from agents who had infiltrated the Syrian government in Damascus and the British Legation in Beirut. This article; based on French; Syrian; Israeli and British sources; argues that under the Labour government; Arabist MI6 officers in the Middle East; in collaboration with the British High Command in Cairo; pursued an alternative policy to that of the Foreign Office. They provoked Egypt’s King Faruq to go to war against Israel without the knowledge or approval of either Prime Minister Clement Attlee or Foreign Secretary Ernest Bevin; frequently misinforming and misleading them. This watershed research provides details of the goals and modus operandi of those involved in that clandestine plot.



To read the complete article; visit:  https://www.tandfonline.com/eprint/UbyBtHKfiix7D3Gr9Ygs/full?target=10.1080/02684527.2019.1616389 








Share this:EmailFacebookTwitterReddit","Posted by Chris Solomon on Monday, June 10th, 2019",https://www.joshualandis.com/blog/the-role-of-mi6-in-egypts-decision-to-go-to-war-against-israel-in-may-1948-by-meir-zamir/
